{
  "version": 1,
  "source": "src/game/items.js pure data consts (canonical-data migration)",
  "RARITIES": [
    "normal",
    "magic",
    "rare",
    "legendary"
  ],
  "QUALITIES": [
    "low",
    "medium",
    "high",
    "elite",
    "exotic"
  ],
  "RARITY_COLORS": {
    "normal": "#c8c8c8",
    "magic": "#6080ff",
    "rare": "#e8d020",
    "legendary": "#ff8020"
  },
  "WEAPON_BASES": {
    "dagger": {
      "name": "Dagger",
      "type": "weapon",
      "subtype": "dagger",
      "weaponCategory": "light",
      "dmg": [
        3,
        7
      ],
      "speed": 1.2,
      "twoHanded": false,
      "statScaling": "dex",
      "armorPen": 0.1,
      "attackSpeed": "fast"
    },
    "sword": {
      "name": "Sword",
      "type": "weapon",
      "subtype": "sword",
      "weaponCategory": "heavy",
      "dmg": [
        6,
        14
      ],
      "speed": 1,
      "twoHanded": false,
      "statScaling": "str_dex"
    },
    "wand": {
      "name": "Wand",
      "type": "weapon",
      "subtype": "wand",
      "weaponCategory": "magic",
      "dmg": [
        4,
        10
      ],
      "speed": 1.1,
      "twoHanded": false,
      "statScaling": "int",
      "offHandOk": true
    },
    "scepter": {
      "name": "Scepter",
      "type": "weapon",
      "subtype": "scepter",
      "weaponCategory": "magic",
      "dmg": [
        5,
        12
      ],
      "speed": 1,
      "twoHanded": false,
      "statScaling": "int",
      "offHandOk": true
    },
    "staff": {
      "name": "Staff",
      "type": "weapon",
      "subtype": "staff",
      "weaponCategory": "magic",
      "dmg": [
        8,
        20
      ],
      "speed": 0.9,
      "twoHanded": true,
      "statScaling": "int",
      "intMult": 1.5
    },
    "hammer": {
      "name": "Hammer",
      "type": "weapon",
      "subtype": "hammer",
      "weaponCategory": "heavy",
      "dmg": [
        8,
        16
      ],
      "speed": 0.8,
      "twoHanded": false,
      "statScaling": "str",
      "stunChance": 0.1
    },
    "sword2h": {
      "name": "Greatsword",
      "type": "weapon",
      "subtype": "sword2h",
      "weaponCategory": "heavy",
      "dmg": [
        14,
        28
      ],
      "speed": 0.7,
      "twoHanded": true,
      "statScaling": "str",
      "strMult": 1.5
    },
    "axe2h": {
      "name": "Greataxe",
      "type": "weapon",
      "subtype": "axe2h",
      "weaponCategory": "heavy",
      "dmg": [
        16,
        30
      ],
      "speed": 0.65,
      "twoHanded": true,
      "statScaling": "str",
      "bleedChance": 0.15
    },
    "bow": {
      "name": "Bow",
      "type": "weapon",
      "subtype": "bow",
      "weaponCategory": "light",
      "dmg": [
        8,
        16
      ],
      "speed": 1,
      "twoHanded": true,
      "statScaling": "dex",
      "dexMult": 1.3,
      "ranged": true
    },
    "crossbow": {
      "name": "Crossbow",
      "type": "weapon",
      "subtype": "crossbow",
      "weaponCategory": "light",
      "dmg": [
        12,
        22
      ],
      "speed": 0.7,
      "twoHanded": true,
      "statScaling": "dex_str",
      "ranged": true
    },
    "javelin": {
      "name": "Javelin",
      "type": "weapon",
      "subtype": "javelin",
      "weaponCategory": "light",
      "dmg": [
        9,
        18
      ],
      "speed": 0.9,
      "twoHanded": false,
      "statScaling": "str_dex",
      "ranged": true,
      "throwable": true
    },
    "longsword": {
      "name": "Longsword",
      "type": "weapon",
      "subtype": "sword",
      "weaponCategory": "heavy",
      "dmg": [
        8,
        16
      ],
      "speed": 0.95,
      "twoHanded": false,
      "statScaling": "str_dex"
    },
    "rapier": {
      "name": "Rapier",
      "type": "weapon",
      "subtype": "sword",
      "weaponCategory": "light",
      "dmg": [
        5,
        11
      ],
      "speed": 1.25,
      "twoHanded": false,
      "statScaling": "dex",
      "critBonus": 0.08,
      "attackSpeed": "fast"
    },
    "shortbow": {
      "name": "Shortbow",
      "type": "weapon",
      "subtype": "bow",
      "weaponCategory": "light",
      "dmg": [
        6,
        12
      ],
      "speed": 1.15,
      "twoHanded": true,
      "statScaling": "dex",
      "ranged": true,
      "attackSpeed": "fast"
    },
    "warhammer": {
      "name": "Warhammer",
      "type": "weapon",
      "subtype": "hammer",
      "weaponCategory": "heavy",
      "dmg": [
        10,
        18
      ],
      "speed": 0.75,
      "twoHanded": false,
      "statScaling": "str",
      "stunChance": 0.12
    },
    "battleaxe": {
      "name": "Battleaxe",
      "type": "weapon",
      "subtype": "axe",
      "weaponCategory": "heavy",
      "dmg": [
        9,
        17
      ],
      "speed": 0.85,
      "twoHanded": false,
      "statScaling": "str",
      "bleedChance": 0.1
    },
    "halberd": {
      "name": "Halberd",
      "type": "weapon",
      "subtype": "polearm",
      "weaponCategory": "heavy",
      "dmg": [
        13,
        24
      ],
      "speed": 0.7,
      "twoHanded": true,
      "statScaling": "str_dex"
    },
    "spear": {
      "name": "Spear",
      "type": "weapon",
      "subtype": "spear",
      "weaponCategory": "light",
      "dmg": [
        8,
        15
      ],
      "speed": 1,
      "twoHanded": false,
      "statScaling": "str_dex",
      "reach": true
    },
    "quarterstaff": {
      "name": "Quarterstaff",
      "type": "weapon",
      "subtype": "staff",
      "weaponCategory": "magic",
      "dmg": [
        7,
        14
      ],
      "speed": 1.05,
      "twoHanded": true,
      "statScaling": "str_int"
    },
    "orb": {
      "name": "Orb",
      "type": "weapon",
      "subtype": "orb",
      "weaponCategory": "magic",
      "dmg": [
        3,
        8
      ],
      "speed": 1.1,
      "twoHanded": false,
      "statScaling": "int",
      "offHandOk": true,
      "intMult": 1.15
    },
    "tome": {
      "name": "Tome",
      "type": "weapon",
      "subtype": "tome",
      "weaponCategory": "magic",
      "dmg": [
        2,
        6
      ],
      "speed": 1,
      "twoHanded": false,
      "statScaling": "int",
      "offHandOk": true,
      "mpBonus": 10
    },
    "greatsword": {
      "name": "Greatsword",
      "type": "weapon",
      "subtype": "sword2h",
      "weaponCategory": "heavy",
      "dmg": [
        15,
        29
      ],
      "speed": 0.68,
      "twoHanded": true,
      "statScaling": "str",
      "strMult": 1.5
    },
    "dragonfang_dagger": {
      "name": "Dragonfang Dagger",
      "type": "weapon",
      "subtype": "dagger",
      "weaponCategory": "light",
      "dmg": [
        14,
        28
      ],
      "speed": 1.25,
      "twoHanded": false,
      "statScaling": "dex",
      "armorPen": 0.25,
      "bleedChance": 0.15,
      "dragon": true,
      "attackSpeed": "fast"
    },
    "dragonfang_sword": {
      "name": "Dragonfang Sword",
      "type": "weapon",
      "subtype": "sword",
      "weaponCategory": "heavy",
      "dmg": [
        22,
        38
      ],
      "speed": 1,
      "twoHanded": false,
      "statScaling": "str_dex",
      "burnChance": 0.15,
      "dragon": true
    },
    "dragonfang_greatsword": {
      "name": "Dragonfang Greatsword",
      "type": "weapon",
      "subtype": "sword2h",
      "weaponCategory": "heavy",
      "dmg": [
        38,
        62
      ],
      "speed": 0.7,
      "twoHanded": true,
      "statScaling": "str",
      "strMult": 1.6,
      "burnChance": 0.2,
      "dragon": true
    },
    "wyrmscale_bow": {
      "name": "Wyrmscale Bow",
      "type": "weapon",
      "subtype": "bow",
      "weaponCategory": "light",
      "dmg": [
        26,
        46
      ],
      "speed": 1,
      "twoHanded": true,
      "statScaling": "dex",
      "dexMult": 1.35,
      "ranged": true,
      "dragon": true
    },
    "dragonbone_staff": {
      "name": "Dragonbone Staff",
      "type": "weapon",
      "subtype": "staff",
      "weaponCategory": "magic",
      "dmg": [
        24,
        50
      ],
      "speed": 0.9,
      "twoHanded": true,
      "statScaling": "int",
      "intMult": 1.6,
      "burnChance": 0.2,
      "dragon": true
    },
    "drakehammer": {
      "name": "Drakehammer",
      "type": "weapon",
      "subtype": "hammer",
      "weaponCategory": "heavy",
      "dmg": [
        24,
        42
      ],
      "speed": 0.78,
      "twoHanded": false,
      "statScaling": "str",
      "stunChance": 0.18,
      "dragon": true
    },
    "dragontooth_wand": {
      "name": "Dragontooth Wand",
      "type": "weapon",
      "subtype": "wand",
      "weaponCategory": "magic",
      "dmg": [
        16,
        34
      ],
      "speed": 1.1,
      "twoHanded": false,
      "statScaling": "int",
      "offHandOk": true,
      "burnChance": 0.2,
      "dragon": true
    },
    "iron_mace": {
      "name": "Iron Mace",
      "type": "weapon",
      "subtype": "mace",
      "weaponCategory": "heavy",
      "dmg": [
        9,
        17
      ],
      "speed": 0.85,
      "twoHanded": false,
      "statScaling": "str",
      "stunChance": 0.08
    },
    "obsidian_scimitar": {
      "name": "Obsidian Scimitar",
      "type": "weapon",
      "subtype": "sword",
      "weaponCategory": "light",
      "dmg": [
        12,
        22
      ],
      "speed": 1.1,
      "twoHanded": false,
      "statScaling": "dex",
      "critBonus": 0.06
    },
    "ember_focus": {
      "name": "Ember Focus",
      "type": "weapon",
      "subtype": "wand",
      "weaponCategory": "magic",
      "dmg": [
        11,
        21
      ],
      "speed": 1.1,
      "twoHanded": false,
      "statScaling": "int",
      "offHandOk": true,
      "burnChance": 0.1
    },
    "voidsteel_greatsword": {
      "name": "Voidsteel Greatsword",
      "type": "weapon",
      "subtype": "sword2h",
      "weaponCategory": "heavy",
      "dmg": [
        28,
        46
      ],